{
  "schema_version": "1.0.0",
  "artifact_id": "artifact-001",
  "artifact_kind": "GENERIC_OUTPUT",
  "media_type": "application/octet-stream",
  "sha256": "aaaaaaaaaaaaaaaaaaaaaaaaaaaaaaaaaaaaaaaaaaaaaaaaaaaaaaaaaaaaaaaa",
  "size_bytes": 256,
  "producer_execution_profile_id": "exec-local-001",
  "parent_artifact_ids": ["input-001"]
}
